{"$schema":"https://memory-os.example/schemas/memory-town/district-expansion-state.v1.schema.json","documentId":"memory-town.district.round7.valid","documentVersion":1,"mapId":"memory-town.map.prototype.round7","layoutRevision":7,"districts":[{"districtInstanceId":"district.central.main","districtDefinitionId":"district.definition.central-grove","districtDefinitionVersion":1,"districtKind":"central","origin":{"cellX":0,"cellY":0,"elevationLevel":0},"orientation":0,"attachedSocketIds":["socket.central.road.south","socket.central.river.south","socket.central.coast.east"],"layoutRevisionCreated":0},{"districtInstanceId":"district.coast.main","districtDefinitionId":"district.definition.coastal-harbor","districtDefinitionVersion":1,"districtKind":"coast","origin":{"cellX":0,"cellY":6,"elevationLevel":0},"orientation":0,"attachedSocketIds":["socket.coast.road.north","socket.coast.river.north","socket.coast.coast.west"],"layoutRevisionCreated":7}],"sockets":[{"socketId":"socket.central.road.south","districtInstanceId":"district.central.main","kind":"road","position":{"cellX":5,"cellY":5,"elevationLevel":0},"outwardDirection":180,"connectionProfileId":"connection.road.standard","occupiedByDistrictInstanceId":"district.coast.main"},{"socketId":"socket.coast.road.north","districtInstanceId":"district.coast.main","kind":"road","position":{"cellX":5,"cellY":6,"elevationLevel":0},"outwardDirection":0,"connectionProfileId":"connection.road.standard","occupiedByDistrictInstanceId":"district.central.main"},{"socketId":"socket.central.river.south","districtInstanceId":"district.central.main","kind":"river","position":{"cellX":3,"cellY":5,"elevationLevel":0},"outwardDirection":180,"connectionProfileId":"connection.river.medium","occupiedByDistrictInstanceId":"district.coast.main"},{"socketId":"socket.coast.river.north","districtInstanceId":"district.coast.main","kind":"river","position":{"cellX":3,"cellY":6,"elevationLevel":0},"outwardDirection":0,"connectionProfileId":"connection.river.medium","occupiedByDistrictInstanceId":"district.central.main"},{"socketId":"socket.central.coast.east","districtInstanceId":"district.central.main","kind":"coast","position":{"cellX":6,"cellY":3,"elevationLevel":0},"outwardDirection":90,"connectionProfileId":"connection.coast.soft"},{"socketId":"socket.coast.coast.west","districtInstanceId":"district.coast.main","kind":"coast","position":{"cellX":0,"cellY":7,"elevationLevel":0},"outwardDirection":270,"connectionProfileId":"connection.coast.soft"}],"connections":[{"connectionId":"connection.central-coast.road","fromSocketId":"socket.central.road.south","toSocketId":"socket.coast.road.north","connectedAtLayoutRevision":7},{"connectionId":"connection.central-coast.river","fromSocketId":"socket.central.river.south","toSocketId":"socket.coast.river.north","connectedAtLayoutRevision":7}]}
